[
  {
    "source_id": "SRC-DGFT-FTP-2023",
    "authority": "DGFT",
    "title": "Foreign Trade Policy 2023",
    "source_type": "REGULATION",
    "canonical_url": "https://www.dgft.gov.in",
    "publication_date": "2023-03-31",
    "effective_date": "2023-04-01",
    "status": "ACTIVE",
    "metadata": {"chapter": "Chapter 2"}
  }
]
